,sentence,label,stripped sentence,predict_region,predict_label,predict_country,predict_city,region,country,city,Aleppo,Algiers,Alexandria,Amman,Aswan,Baghdad,Basra,Beirut,Benghazi,Cairo,Damascus,Doha,Fes,Jeddha,Jerusalem,Khartoum,Mosul,Modern Standard Arabic,Muscat,Rabat,Riyadh,Salt,Sana'a,Sfax,Tripoli,Tunis,sentence tokens,length of sentence
31,ورغم انتشار المركبات المدرعة والجنود في بعض المدن الرئيسية في ميانمار مطلع الأسبوع الحالي، واصل المحتجون حملتهم لرفض الحكم العسكري والمطالبة بإطلاق سراح سوتشي، إذ أوقف المحتجون خدمة القطارات بين يانغون -كبرى مدن البلاد- ومدينة ماولاميني الساحلية الواقع جنوبي البلاد.,JAZ,ورغم انتشار المركبات المدرعة والجنود في بعض المدن الرئيسية في ميانمار مطلع الأسبوع الحالي واصل المحتجون حملتهم لرفض الحكم العسكري والمطالبة بإطلاق سراح سوتشي إذ أوقف المحتجون خدمة القطارات بين يانغون كبرى مدن البلاد ومدينة ماولاميني الساحلية الواقع جنوبي البلاد,Modern Standard Arabic,MSA,Modern Standard Arabic,Modern Standard Arabic,Modern Standard Arabic,Modern Standard Arabic,Modern Standard Arabic,9.769007493977876e-05,0.00015194473521524293,4.129127294705864e-06,0.0004532016710979641,1.9829625179519383e-05,5.794934030262887e-05,2.4769114503381897e-05,4.671847706713584e-06,0.0009877774878326042,4.621150795654295e-05,0.0001321463784589579,0.0006455126958721353,1.3361587721657945e-05,0.001672801320850124,0.0002659358195877809,0.11742200124318544,1.9124731907592798e-06,0.7342656475115352,0.1302351341575104,1.644159214662229e-06,0.012625835999118257,0.00020900274460428715,0.00026945210632868945,2.9909221631590702e-05,0.00035832476708964124,3.2032820712575537e-06,"['ورغم', 'انتشار', 'المركبات', 'المدرعة', 'والجنود', 'في', 'بعض', 'المدن', 'الرئيسية', 'في', 'ميانمار', 'مطلع', 'الأسبوع', 'الحالي', 'واصل', 'المحتجون', 'حملتهم', 'لرفض', 'الحكم', 'العسكري', 'والمطالبة', 'بإطلاق', 'سراح', 'سوتشي', 'إذ', 'أوقف', 'المحتجون', 'خدمة', 'القطارات', 'بين', 'يانغون', 'كبرى', 'مدن', 'البلاد', 'ومدينة', 'ماولاميني', 'الساحلية', 'الواقع', 'جنوبي', 'البلاد']",40
32,"وتحدثت المبعوثة الخاصة للأمم المتحدة كريستين شرانر بورغنر أمس الاثنين إلى نائب رئيس المجلس العسكري، وقال المتحدث باسم الأمم المتحدة فرحان حق ""شددت شرانر بورغنر على وجوب الاحترام الكامل للحق في التجمع السلمي، وعدم تعرض المتظاهرين لأعمال انتقامية"".",JAZ,وتحدثت المبعوثة الخاصة للأمم المتحدة كريستين شرانر بورغنر أمس الاثنين إلى نائب رئيس المجلس العسكري وقال المتحدث باسم الأمم المتحدة فرحان حق شددت شرانر بورغنر على وجوب الاحترام الكامل للحق في التجمع السلمي وعدم تعرض المتظاهرين لأعمال انتقامية,Modern Standard Arabic,MSA,Modern Standard Arabic,Modern Standard Arabic,Modern Standard Arabic,Modern Standard Arabic,Modern Standard Arabic,2.0515945661441862e-07,4.504930987773547e-05,1.091785408831345e-07,1.2412088046474276e-06,1.5618354916342847e-07,1.6917291147375624e-06,1.3087813867735182e-06,5.518135564956549e-08,1.7463027290532476e-05,1.4121071240297764e-07,1.142922004821362e-06,7.71818927524679e-05,4.286144790407621e-06,2.5637453211298096e-05,7.654902125475408e-07,5.1590850243686525e-05,1.2548125126232356e-07,0.8937864851491141,0.10550684480869592,6.021377705563283e-08,0.00046768768875768483,6.607659342343292e-06,3.5733707865942864e-06,2.252861354728971e-07,2.3199026743809946e-07,1.3262856774769748e-07,"['وتحدثت', 'المبعوثة', 'الخاصة', 'للأمم', 'المتحدة', 'كريستين', 'شرانر', 'بورغنر', 'أمس', 'الاثنين', 'إلى', 'نائب', 'رئيس', 'المجلس', 'العسكري', 'وقال', 'المتحدث', 'باسم', 'الأمم', 'المتحدة', 'فرحان', 'حق', 'شددت', 'شرانر', 'بورغنر', 'على', 'وجوب', 'الاحترام', 'الكامل', 'للحق', 'في', 'التجمع', 'السلمي', 'وعدم', 'تعرض', 'المتظاهرين', 'لأعمال', 'انتقامية']",38
33,ويقول حسين للجزيرة نت إن إثيوبيا، ومن دون إبلاغ السودان، عمدت في الملء الأول لتعبئة 4.5 مليارات متر مكعب في أسبوع واحد فقط في شهر يوليو/تموز الماضي، بينما كان يمكن ملء الكمية ذاتها في وقت أطول وخلال أغسطس/آب السابق الذي يشهد ذروة الفيضان، وهو ما كان سيقلل من أضرار الفيضان.,JAZ,ويقول حسين للجزيرة نت إن إثيوبيا ومن دون إبلاغ السودان عمدت في الملء الأول لتعبئة 45 مليارات متر مكعب في أسبوع واحد فقط في شهر يوليوتموز الماضي بينما كان يمكن ملء الكمية ذاتها في وقت أطول وخلال أغسطسآب السابق الذي يشهد ذروة الفيضان وهو ما كان سيقلل من أضرار الفيضان,Gulf,MUS,Oman,Muscat,Modern Standard Arabic,Modern Standard Arabic,Modern Standard Arabic,5.165626164462626e-08,1.458459962437411e-07,8.22588139080775e-09,1.824909996521728e-07,1.635181004077255e-08,2.5326625993930952e-08,1.1925203018191246e-08,1.6323825235715467e-08,1.3867491413142814e-07,5.993996185676787e-08,8.909540219195209e-08,1.0558003352787452e-07,6.713049479401591e-08,3.825140383553332e-07,3.804398284572661e-08,3.4423454971484826e-06,6.125506705503763e-09,0.002266740578130843,0.9977224351600452,1.3213149079935576e-09,5.769911084992854e-06,6.602886412022654e-08,1.4302347380986955e-07,6.724027865210514e-09,3.2676004083930664e-08,1.698061929547471e-08,"['ويقول', 'حسين', 'للجزيرة', 'نت', 'إن', 'إثيوبيا', 'ومن', 'دون', 'إبلاغ', 'السودان', 'عمدت', 'في', 'الملء', 'الأول', 'لتعبئة', '45', 'مليارات', 'متر', 'مكعب', 'في', 'أسبوع', 'واحد', 'فقط', 'في', 'شهر', 'يوليوتموز', 'الماضي', 'بينما', 'كان', 'يمكن', 'ملء', 'الكمية', 'ذاتها', 'في', 'وقت', 'أطول', 'وخلال', 'أغسطسآب', 'السابق', 'الذي', 'يشهد', 'ذروة', 'الفيضان', 'وهو', 'ما', 'كان', 'سيقلل', 'من', 'أضرار', 'الفيضان']",50
34,ويوضح عوض أن إدارته اعتادت كل عام فتح بوابات الخزانات في الأول من يوليو/تموز لتصريف المياه المخزنة استعدادا لاستقبال وتخزين مياه النيل في فترة الفيضان، لكنها هذا العام ستفرغ السدود يوم 31 يوليو/تموز المقبل.,JAZ,ويوضح عوض أن إدارته اعتادت كل عام فتح بوابات الخزانات في الأول من يوليوتموز لتصريف المياه المخزنة استعدادا لاستقبال وتخزين مياه النيل في فترة الفيضان لكنها هذا العام ستفرغ السدود يوم 31 يوليوتموز المقبل,Modern Standard Arabic,MSA,Modern Standard Arabic,Modern Standard Arabic,Modern Standard Arabic,Modern Standard Arabic,Modern Standard Arabic,3.039785612409406e-09,1.4908859472719306e-07,2.1507647846276395e-09,5.158092669765026e-09,3.598288523272145e-09,1.2699176378244435e-08,4.511530799258134e-09,1.3449531823382091e-09,3.666608162022558e-08,5.152549200611611e-09,8.039936364895748e-09,5.924544260508418e-09,9.921386581085828e-09,2.7580604403595768e-08,3.2958327968035262e-09,1.8917585528333322e-06,1.4187031857964303e-09,0.9987386546561637,0.0012579102286892146,4.926857120953258e-10,1.2068326693212464e-06,6.84096027140595e-09,3.612310730477513e-08,3.487015944754529e-09,8.446770214007715e-09,1.542560190759141e-09,"['ويوضح', 'عوض', 'أن', 'إدارته', 'اعتادت', 'كل', 'عام', 'فتح', 'بوابات', 'الخزانات', 'في', 'الأول', 'من', 'يوليوتموز', 'لتصريف', 'المياه', 'المخزنة', 'استعدادا', 'لاستقبال', 'وتخزين', 'مياه', 'النيل', 'في', 'فترة', 'الفيضان', 'لكنها', 'هذا', 'العام', 'ستفرغ', 'السدود', 'يوم', '31', 'يوليوتموز', 'المقبل']",34
35,ويكشف المسؤول السوداني للجزيرة نت أن ما حال دون تلاقي وجهات النظر حول سد النهضة أنه منذ بدء التفاوض غلب على الوفد المفاوض المصري رجال المخابرات، وعلى الوفد الإثيوبي القانونيون، وعلى الوفد السوداني الفنيون.,JAZ,ويكشف المسؤول السوداني للجزيرة نت أن ما حال دون تلاقي وجهات النظر حول سد النهضة أنه منذ بدء التفاوض غلب على الوفد المفاوض المصري رجال المخابرات وعلى الوفد الإثيوبي القانونيون وعلى الوفد السوداني الفنيون,Levant,AMM,Jordan,Amman,Modern Standard Arabic,Modern Standard Arabic,Modern Standard Arabic,0.0003300454837783162,2.1050643768941367e-05,7.540396707508412e-06,0.7338664036051465,1.7742670581852e-05,0.000649657548334953,0.0004069690624113921,7.191095035764351e-05,0.0007228106850829038,3.5171214624628094e-05,0.018810630098804255,0.0002234461538160636,3.38115462238022e-06,0.0018496756245199597,0.0035254603782647826,0.012865927239225744,2.6702273591275323e-05,0.03480731483148946,0.1763491422185775,5.081364795941321e-07,0.004284538369196063,0.011047792858630301,6.754330478238912e-05,1.6453550555808489e-06,6.575844570759172e-06,4.1389757915949797e-07,"['ويكشف', 'المسؤول', 'السوداني', 'للجزيرة', 'نت', 'أن', 'ما', 'حال', 'دون', 'تلاقي', 'وجهات', 'النظر', 'حول', 'سد', 'النهضة', 'أنه', 'منذ', 'بدء', 'التفاوض', 'غلب', 'على', 'الوفد', 'المفاوض', 'المصري', 'رجال', 'المخابرات', 'وعلى', 'الوفد', 'الإثيوبي', 'القانونيون', 'وعلى', 'الوفد', 'السوداني', 'الفنيون']",34
36,وبحسب موقع ذا هيل، فهذه أعلى نسبة من المواطنين الأميركيين تعبر عن حاجة البلد لحزب ثالث منذ أن بدأت غالوب استطلاع الآراء حول هذه المسألة عام 2003. ويشير الاستطلاع أيضا إلى ثاني أقل نسبة مئوية من الأشخاص الذين قالوا إن الأحزاب الحالية كافية بعد أن قال 26% من المشاركين ذلك في استطلاع أكتوبر/تشرين الأول 2013.,JAZ,وبحسب موقع ذا هيل فهذه أعلى نسبة من المواطنين الأميركيين تعبر عن حاجة البلد لحزب ثالث منذ أن بدأت غالوب استطلاع الآراء حول هذه المسألة عام 2003 ويشير الاستطلاع أيضا إلى ثاني أقل نسبة مئوية من الأشخاص الذين قالوا إن الأحزاب الحالية كافية بعد أن قال 26 من المشاركين ذلك في استطلاع أكتوبرتشرين الأول 2013,Modern Standard Arabic,MSA,Modern Standard Arabic,Modern Standard Arabic,Modern Standard Arabic,Modern Standard Arabic,Modern Standard Arabic,1.6589145217698165e-09,4.825616150529876e-08,3.837903414946585e-09,4.3572224775982015e-09,6.259920320456646e-10,4.5438777410591346e-09,1.165500874188566e-09,3.357280440320839e-10,1.674945247140424e-08,1.7820207006054863e-09,5.135095159765323e-09,1.8309951788216194e-09,4.443567799391136e-09,4.670750198003166e-09,4.867447611084847e-10,1.1174619612460034e-06,2.604840576151143e-10,0.9990394892167354,0.0009589090206895854,1.2058512901729169e-10,3.621305041342757e-07,2.7101122605530604e-09,1.799558053312677e-08,7.738564808492157e-10,1.7517819645773813e-10,2.543864244351952e-10,"['وبحسب', 'موقع', 'ذا', 'هيل', 'فهذه', 'أعلى', 'نسبة', 'من', 'المواطنين', 'الأميركيين', 'تعبر', 'عن', 'حاجة', 'البلد', 'لحزب', 'ثالث', 'منذ', 'أن', 'بدأت', 'غالوب', 'استطلاع', 'الآراء', 'حول', 'هذه', 'المسألة', 'عام', '2003', 'ويشير', 'الاستطلاع', 'أيضا', 'إلى', 'ثاني', 'أقل', 'نسبة', 'مئوية', 'من', 'الأشخاص', 'الذين', 'قالوا', 'إن', 'الأحزاب', 'الحالية', 'كافية', 'بعد', 'أن', 'قال', '26', 'من', 'المشاركين', 'ذلك', 'في', 'استطلاع', 'أكتوبرتشرين', 'الأول', '2013']",55
37,وتستند نتائج استطلاع غالوب إلى ردود عينة من 906 من الأميركيين البالغين موزعين على جميع الولايات الخمسين، بالإضافة إلى واشنطن العاصمة، وذلك خلال الفترة من 21 يناير/كانون الثاني الماضي إلى 2 فبراير/شباط الحالي، ويقدر هامش الخطأ في هذا الاستطلاع بأربع نقاط مئوية.,JAZ,وتستند نتائج استطلاع غالوب إلى ردود عينة من 906 من الأميركيين البالغين موزعين على جميع الولايات الخمسين بالإضافة إلى واشنطن العاصمة وذلك خلال الفترة من 21 ينايركانون الثاني الماضي إلى 2 فبرايرشباط الحالي ويقدر هامش الخطأ في هذا الاستطلاع بأربع نقاط مئوية,Modern Standard Arabic,MSA,Modern Standard Arabic,Modern Standard Arabic,Modern Standard Arabic,Modern Standard Arabic,Modern Standard Arabic,2.802573374013606e-09,1.43899725969801e-07,8.474829888925087e-10,4.578130475486737e-09,3.759516930664478e-10,1.0401639820957986e-08,2.899471975666359e-09,2.9119160690372306e-10,7.4470637469117535e-09,1.189781927959603e-09,3.7228227794953075e-09,1.1699516587253732e-09,1.1857479758066713e-08,3.686008426250871e-09,6.082766007006522e-10,6.550297578128493e-07,1.6324514928888676e-09,0.9998626340481921,0.00013604367505398976,1.0072919338693218e-09,4.5261844329951615e-07,6.326927330036393e-09,7.131511845664648e-09,7.891306612494076e-10,4.997242255936033e-10,1.4639626186714339e-09,"['وتستند', 'نتائج', 'استطلاع', 'غالوب', 'إلى', 'ردود', 'عينة', 'من', '906', 'من', 'الأميركيين', 'البالغين', 'موزعين', 'على', 'جميع', 'الولايات', 'الخمسين', 'بالإضافة', 'إلى', 'واشنطن', 'العاصمة', 'وذلك', 'خلال', 'الفترة', 'من', '21', 'ينايركانون', 'الثاني', 'الماضي', 'إلى', '2', 'فبرايرشباط', 'الحالي', 'ويقدر', 'هامش', 'الخطأ', 'في', 'هذا', 'الاستطلاع', 'بأربع', 'نقاط', 'مئوية']",42
38,"وأشار إلى ما وصفه بتوازن بايدن الذهبي، وهو تحالف عالمي للديمقراطيات لمواجهة الصين بشكل جماعي، الذي وعد به في حملته الانتخابية، وهو ما أطلق عليه ""قمة للديمقراطية"" لتجديد الروح والهدف المشترك لدول العالم الحر.",JAZ,وأشار إلى ما وصفه بتوازن بايدن الذهبي وهو تحالف عالمي للديمقراطيات لمواجهة الصين بشكل جماعي الذي وعد به في حملته الانتخابية وهو ما أطلق عليه قمة للديمقراطية لتجديد الروح والهدف المشترك لدول العالم الحر,Modern Standard Arabic,MSA,Modern Standard Arabic,Modern Standard Arabic,Modern Standard Arabic,Modern Standard Arabic,Modern Standard Arabic,1.0156704339865874e-07,1.1633776081171183e-07,6.208764523249695e-09,3.6656024179812065e-07,1.2143480121916735e-08,3.959911558323321e-07,1.2281752114313315e-07,2.1349369921447773e-08,7.037196593811363e-07,3.60894650107437e-08,2.1993634545765913e-07,2.1176932331099723e-07,1.9226021357723315e-08,9.016259918941425e-07,2.410647379595974e-07,0.00026020116369425406,5.633115482193976e-08,0.9943073951375839,0.005394694368748866,1.486483068279251e-09,3.052665051501111e-05,3.314598283617025e-07,3.036079014498595e-06,2.8662038157276516e-08,2.446971979049017e-07,7.556859396837948e-09,"['وأشار', 'إلى', 'ما', 'وصفه', 'بتوازن', 'بايدن', 'الذهبي', 'وهو', 'تحالف', 'عالمي', 'للديمقراطيات', 'لمواجهة', 'الصين', 'بشكل', 'جماعي', 'الذي', 'وعد', 'به', 'في', 'حملته', 'الانتخابية', 'وهو', 'ما', 'أطلق', 'عليه', 'قمة', 'للديمقراطية', 'لتجديد', 'الروح', 'والهدف', 'المشترك', 'لدول', 'العالم', 'الحر']",34
39,وأردف الكاتب أنه لكي ينجح التحالف المبدئي الجديد للديمقراطيات ضد الصين يجب أن تكون مكوناته ديمقراطية، بمعنى أن الضغط على الصين بشأن حقوق الإنسان مع تجاهل الانتهاكات الجسيمة من قبل الحلفاء ليس نظرة جيدة للزعيم الجديد للعالم الحر، لا سيما أن بايدن يقدم نفسه على أنه النقيض الأخلاقي لسلفه دونالد ترامب.,JAZ,وأردف الكاتب أنه لكي ينجح التحالف المبدئي الجديد للديمقراطيات ضد الصين يجب أن تكون مكوناته ديمقراطية بمعنى أن الضغط على الصين بشأن حقوق الإنسان مع تجاهل الانتهاكات الجسيمة من قبل الحلفاء ليس نظرة جيدة للزعيم الجديد للعالم الحر لا سيما أن بايدن يقدم نفسه على أنه النقيض الأخلاقي لسلفه دونالد ترامب,Modern Standard Arabic,MSA,Modern Standard Arabic,Modern Standard Arabic,Modern Standard Arabic,Modern Standard Arabic,Modern Standard Arabic,7.967358348289198e-10,2.171555143243256e-08,1.7699715618996426e-09,1.7823294540431926e-08,2.2257506811052178e-09,1.3121217896534464e-08,1.6685504537557025e-09,1.3867477581271053e-10,2.0894168566138123e-08,2.382956070636615e-09,6.333241486001858e-09,6.973879683468271e-10,5.648845950777295e-09,7.136469048330251e-09,1.2401221876888606e-09,1.015562345909609e-06,1.3200172025854927e-09,0.9999464113268974,5.226990685532767e-05,9.147251683373446e-10,1.7997121674599206e-07,2.536866780713463e-09,1.378583161948853e-08,2.1675576366161591e-10,7.212281669555948e-10,1.4432146365648284e-10,"['وأردف', 'الكاتب', 'أنه', 'لكي', 'ينجح', 'التحالف', 'المبدئي', 'الجديد', 'للديمقراطيات', 'ضد', 'الصين', 'يجب', 'أن', 'تكون', 'مكوناته', 'ديمقراطية', 'بمعنى', 'أن', 'الضغط', 'على', 'الصين', 'بشأن', 'حقوق', 'الإنسان', 'مع', 'تجاهل', 'الانتهاكات', 'الجسيمة', 'من', 'قبل', 'الحلفاء', 'ليس', 'نظرة', 'جيدة', 'للزعيم', 'الجديد', 'للعالم', 'الحر', 'لا', 'سيما', 'أن', 'بايدن', 'يقدم', 'نفسه', 'على', 'أنه', 'النقيض', 'الأخلاقي', 'لسلفه', 'دونالد', 'ترامب']",51
40,وفي أول تعليق رسمي له على أزمة اليمين الدستورية، توجّه رئيس الجمهورية قيس سعيد برسالة مطولة إلى رئيس الحكومة مساء اليوم الاثنين، لم تخل من طابع اللوم والتهجم بعبارات لاذعة، اتهمه خلالها بخرق فصول من الدستور ذات علاقة بالتعديل الوزاري.,JAZ,وفي أول تعليق رسمي له على أزمة اليمين الدستورية توجّه رئيس الجمهورية قيس سعيد برسالة مطولة إلى رئيس الحكومة مساء اليوم الاثنين لم تخل من طابع اللوم والتهجم بعبارات لاذعة اتهمه خلالها بخرق فصول من الدستور ذات علاقة بالتعديل الوزاري,Gulf,MUS,Oman,Muscat,Modern Standard Arabic,Modern Standard Arabic,Modern Standard Arabic,9.420489873317495e-05,0.0009612615986175273,5.765465574878462e-06,0.0009850745028336962,6.236873355459267e-06,0.008425340149172265,0.00047710964739383513,1.7413865645119297e-05,0.0004867734255103702,2.0613150684392038e-05,0.0013643942114623165,0.00041888381516024155,5.706494583880447e-06,0.0012264758774901113,0.0008582624536210935,0.02098118363870547,8.417674250282086e-06,0.21454265707446854,0.6809048420359852,2.0980681758898827e-07,0.018627715985259266,0.04939426776012481,0.00015925196566837877,6.568516309774179e-06,1.9716950364427565e-05,1.6521622080300063e-06,"['وفي', 'أول', 'تعليق', 'رسمي', 'له', 'على', 'أزمة', 'اليمين', 'الدستورية', 'توجّه', 'رئيس', 'الجمهورية', 'قيس', 'سعيد', 'برسالة', 'مطولة', 'إلى', 'رئيس', 'الحكومة', 'مساء', 'اليوم', 'الاثنين', 'لم', 'تخل', 'من', 'طابع', 'اللوم', 'والتهجم', 'بعبارات', 'لاذعة', 'اتهمه', 'خلالها', 'بخرق', 'فصول', 'من', 'الدستور', 'ذات', 'علاقة', 'بالتعديل', 'الوزاري']",40
41,وقال النائب عن حركة النهضة محمد القوماني في حديثه للجزيرة نت إن استكمال المشيشي إقالة 5 وزراء في الحكومة الحالية، إضافة لثلاثة سابقين، وما ستحدثه من شغور في الحكومة، يعد خطوة متقدمة في التعقيد القانوني والسياسي الذي بلغه الصراع بين رأسي السلطة التنفيذية.,JAZ,وقال النائب عن حركة النهضة محمد القوماني في حديثه للجزيرة نت إن استكمال المشيشي إقالة 5 وزراء في الحكومة الحالية إضافة لثلاثة سابقين وما ستحدثه من شغور في الحكومة يعد خطوة متقدمة في التعقيد القانوني والسياسي الذي بلغه الصراع بين رأسي السلطة التنفيذية,Modern Standard Arabic,MSA,Modern Standard Arabic,Modern Standard Arabic,Modern Standard Arabic,Modern Standard Arabic,Modern Standard Arabic,2.555583930726678e-08,2.1275938964875703e-07,1.9804934089803847e-09,1.1142891702162915e-07,1.1518705500008865e-08,2.509287687766477e-08,7.888515389186238e-09,5.638924899059159e-09,3.6345106492491957e-07,6.616386666352968e-08,7.114899967812859e-08,1.0681408462555193e-06,2.2135874527602936e-08,9.347086360322012e-07,1.0521848027820324e-07,5.0068049698817475e-06,9.99264641895532e-10,0.9996740226310644,0.0002976220648090565,3.6207592856574964e-10,1.9829086780862606e-05,2.0831521779689264e-07,2.3200845290135065e-07,2.63543787755017e-08,1.3486023795292677e-08,5.055531299959015e-09,"['وقال', 'النائب', 'عن', 'حركة', 'النهضة', 'محمد', 'القوماني', 'في', 'حديثه', 'للجزيرة', 'نت', 'إن', 'استكمال', 'المشيشي', 'إقالة', '5', 'وزراء', 'في', 'الحكومة', 'الحالية', 'إضافة', 'لثلاثة', 'سابقين', 'وما', 'ستحدثه', 'من', 'شغور', 'في', 'الحكومة', 'يعد', 'خطوة', 'متقدمة', 'في', 'التعقيد', 'القانوني', 'والسياسي', 'الذي', 'بلغه', 'الصراع', 'بين', 'رأسي', 'السلطة', 'التنفيذية']",43
