,sentence,label,stripped sentence,predict_region,predict_label,predict_country,predict_city,region,country,city,Aleppo,Algiers,Alexandria,Amman,Aswan,Baghdad,Basra,Beirut,Benghazi,Cairo,Damascus,Doha,Fes,Jeddha,Jerusalem,Khartoum,Mosul,Modern Standard Arabic,Muscat,Rabat,Riyadh,Salt,Sana'a,Sfax,Tripoli,Tunis,sentence tokens,length of sentence
20,"وقال نونو لهيئة البث ""الهدف هو توحيد موارد المجتمعات، مثل طعام الكوشر الحلال (وفق الشريعة اليهودية) وكذلك المساعدات الدينية، والدفن وغيرها من الأمور"". وكانت الإمارات والبحرين قد وقعتا العام الماضي اتفاقيتين من أجل تطبيع العلاقات مع إسرائيل.",JAZ,وقال نونو لهيئة البث الهدف هو توحيد موارد المجتمعات مثل طعام الكوشر الحلال وفق الشريعة اليهودية وكذلك المساعدات الدينية والدفن وغيرها من الأمور وكانت الإمارات والبحرين قد وقعتا العام الماضي اتفاقيتين من أجل تطبيع العلاقات مع إسرائيل,Modern Standard Arabic,MSA,Modern Standard Arabic,Modern Standard Arabic,Modern Standard Arabic,Modern Standard Arabic,Modern Standard Arabic,4.37328387636664e-09,1.9586339059838947e-08,3.9204215749594895e-10,4.587885493047911e-09,6.221320831480548e-10,9.739347426542952e-09,4.183353265705303e-09,4.116067867275372e-10,1.0696883614730953e-08,7.000144514607835e-10,3.931402229350393e-09,6.688666979191155e-09,3.4775667312721923e-09,1.1331472231542551e-08,4.577011521666714e-09,2.3677772167862014e-07,3.909910260494701e-09,0.9999867165853166,1.178435736074477e-05,2.416708931944601e-10,1.1448295368319416e-06,7.48076377096629e-09,1.8994486189458484e-08,2.764821972825715e-10,1.0023343871286157e-09,2.4540866739474136e-10,"['وقال', 'نونو', 'لهيئة', 'البث', 'الهدف', 'هو', 'توحيد', 'موارد', 'المجتمعات', 'مثل', 'طعام', 'الكوشر', 'الحلال', 'وفق', 'الشريعة', 'اليهودية', 'وكذلك', 'المساعدات', 'الدينية', 'والدفن', 'وغيرها', 'من', 'الأمور', 'وكانت', 'الإمارات', 'والبحرين', 'قد', 'وقعتا', 'العام', 'الماضي', 'اتفاقيتين', 'من', 'أجل', 'تطبيع', 'العلاقات', 'مع', 'إسرائيل']",37
21,جاء ذلك في أول اجتماع لمجلس الوزراء في العام الجاري. وكان الجانبان قد وقعا في البيت الأبيض منتصف سبتمبر/أيلول الماضي اتفاقية لتطبيع العلاقات، برعاية الرئيس الأميركي السابق دونالد ترامب.,JAZ,جاء ذلك في أول اجتماع لمجلس الوزراء في العام الجاري وكان الجانبان قد وقعا في البيت الأبيض منتصف سبتمبرأيلول الماضي اتفاقية لتطبيع العلاقات برعاية الرئيس الأميركي السابق دونالد ترامب,Gulf,MUS,Oman,Muscat,Modern Standard Arabic,Modern Standard Arabic,Modern Standard Arabic,1.8074751007488181e-06,9.747088362589074e-06,1.9821323337505743e-07,1.1309851033228416e-05,4.017560903365643e-06,3.919369641713095e-06,3.1353457736805785e-06,6.592250030442772e-07,2.0036968335717094e-05,8.660687560037749e-06,8.619274426121945e-06,5.3853313629638056e-05,6.587427982118064e-07,0.0002761643439853852,6.67920064564099e-06,0.0037655516287780303,3.0761631669128516e-07,0.009609966528680727,0.9690801548121817,5.574188015889192e-08,0.01709793766920566,8.600059537914076e-06,2.5315335677785573e-05,4.383933918492694e-07,1.774182708759449e-06,4.313712080059261e-07,"['جاء', 'ذلك', 'في', 'أول', 'اجتماع', 'لمجلس', 'الوزراء', 'في', 'العام', 'الجاري', 'وكان', 'الجانبان', 'قد', 'وقعا', 'في', 'البيت', 'الأبيض', 'منتصف', 'سبتمبرأيلول', 'الماضي', 'اتفاقية', 'لتطبيع', 'العلاقات', 'برعاية', 'الرئيس', 'الأميركي', 'السابق', 'دونالد', 'ترامب']",29
22,وقال مستشار الأمن القومي الأميركي جيك سوليفان -في بيان صدر اليوم الأحد- إنه أخبر نظيره الإسرائيلي مائير بن شبات في اتصال هاتفي جرى أمس، أن إدارة الرئيس جو بايدن ستعمل عن كثب مع إسرائيل بشأن الأمن وتطبيع العلاقات في الشرق الأوسط.,JAZ,وقال مستشار الأمن القومي الأميركي جيك سوليفان في بيان صدر اليوم الأحد إنه أخبر نظيره الإسرائيلي مائير بن شبات في اتصال هاتفي جرى أمس أن إدارة الرئيس جو بايدن ستعمل عن كثب مع إسرائيل بشأن الأمن وتطبيع العلاقات في الشرق الأوسط,Modern Standard Arabic,MSA,Modern Standard Arabic,Modern Standard Arabic,Modern Standard Arabic,Modern Standard Arabic,Modern Standard Arabic,1.6680481669347904e-07,5.735416755119058e-07,3.200008085487564e-08,1.8798953221562343e-06,2.9221868489659334e-08,7.387984408072695e-08,9.279461388658875e-09,1.0383665485689428e-07,5.315960833628071e-07,1.0290557121561085e-07,5.044899909923407e-07,1.8090200348153387e-06,5.873931510681122e-08,2.9499837208310744e-07,1.2259872693565993e-06,2.562917489366945e-05,3.576810378029022e-09,0.9862952592694596,0.013668687366138833,3.4944884526372407e-09,2.6987898040773474e-06,1.3852606575730696e-07,1.2727219927882147e-07,1.7149049387845224e-09,5.0130821762406143e-08,4.4880523543008e-09,"['وقال', 'مستشار', 'الأمن', 'القومي', 'الأميركي', 'جيك', 'سوليفان', 'في', 'بيان', 'صدر', 'اليوم', 'الأحد', 'إنه', 'أخبر', 'نظيره', 'الإسرائيلي', 'مائير', 'بن', 'شبات', 'في', 'اتصال', 'هاتفي', 'جرى', 'أمس', 'أن', 'إدارة', 'الرئيس', 'جو', 'بايدن', 'ستعمل', 'عن', 'كثب', 'مع', 'إسرائيل', 'بشأن', 'الأمن', 'وتطبيع', 'العلاقات', 'في', 'الشرق', 'الأوسط']",41
23,وأشار مراسل الجزيرة في واشنطن أحمد هزيم إلى شهادة وزير الخارجية الأميركي الجديد أنتوني بلينكن أمام مجلس الشيوخ ضمن إجراءات المصادقة على تعيينه، حيث قال إن الإدارة الجديدة ستعمل ببطء لإعادة بناء الثقة بين طرفي النزاع، لتصل بعد ذلك إلى خطة أو مقترح لإطلاق المفاوضات.,JAZ,وأشار مراسل الجزيرة في واشنطن أحمد هزيم إلى شهادة وزير الخارجية الأميركي الجديد أنتوني بلينكن أمام مجلس الشيوخ ضمن إجراءات المصادقة على تعيينه حيث قال إن الإدارة الجديدة ستعمل ببطء لإعادة بناء الثقة بين طرفي النزاع لتصل بعد ذلك إلى خطة أو مقترح لإطلاق المفاوضات,Modern Standard Arabic,MSA,Modern Standard Arabic,Modern Standard Arabic,Modern Standard Arabic,Modern Standard Arabic,Modern Standard Arabic,2.0697550878267897e-09,4.801893145792706e-08,9.08629973266353e-09,5.2644291332317085e-09,6.401756129119111e-10,1.547293195049674e-09,5.086085322371946e-10,1.0452832658462305e-09,3.4629122504138834e-09,1.915095984641558e-09,6.898934575046531e-09,4.424356437595654e-10,3.893418303277431e-09,6.4338351532286045e-09,5.151380090585921e-10,4.548638917819474e-05,1.4247761156009364e-10,0.9997779747502414,0.00017638128046363791,2.5565081133772867e-10,6.138502261286184e-08,1.4785276452920481e-09,2.248104611370035e-09,6.654186816095619e-11,1.1087159384894692e-10,1.5037397224263398e-10,"['وأشار', 'مراسل', 'الجزيرة', 'في', 'واشنطن', 'أحمد', 'هزيم', 'إلى', 'شهادة', 'وزير', 'الخارجية', 'الأميركي', 'الجديد', 'أنتوني', 'بلينكن', 'أمام', 'مجلس', 'الشيوخ', 'ضمن', 'إجراءات', 'المصادقة', 'على', 'تعيينه', 'حيث', 'قال', 'إن', 'الإدارة', 'الجديدة', 'ستعمل', 'ببطء', 'لإعادة', 'بناء', 'الثقة', 'بين', 'طرفي', 'النزاع', 'لتصل', 'بعد', 'ذلك', 'إلى', 'خطة', 'أو', 'مقترح', 'لإطلاق', 'المفاوضات']",45
24,"وتنقل الصحيفة الفرنسية عن الروائي الجزائري محمد مولسهول (المشهور بياسمينة خضرا) قوله إن الجزائر ""كانت تستحق مصيرا أفضل من هذا""، داعيا إلى إطلاق سراح جميع معتقلي الرأي القابعين في السجون.",JAZ,وتنقل الصحيفة الفرنسية عن الروائي الجزائري محمد مولسهول المشهور بياسمينة خضرا قوله إن الجزائر كانت تستحق مصيرا أفضل من هذا داعيا إلى إطلاق سراح جميع معتقلي الرأي القابعين في السجون,Modern Standard Arabic,MSA,Modern Standard Arabic,Modern Standard Arabic,Modern Standard Arabic,Modern Standard Arabic,Modern Standard Arabic,7.452706161775198e-10,3.8438314869614836e-08,3.5064920865095023e-10,1.9656427491716244e-09,3.1228567165364764e-10,1.8863947289556372e-09,5.860065081142812e-10,3.121191769472309e-10,1.7391773909676304e-09,1.6076554485326085e-09,2.1066638785862033e-09,5.691038453622591e-10,1.3059886224664287e-08,6.722756705911914e-09,3.601963618970563e-10,3.4521670197540583e-07,1.6509767394700742e-10,0.9960905759307543,0.00390843939547328,7.605577209637883e-11,5.57255608160764e-07,2.4630084879273913e-09,8.054601723618469e-09,2.0252895549041328e-10,2.2210703174406883e-10,2.559391916221496e-10,"['وتنقل', 'الصحيفة', 'الفرنسية', 'عن', 'الروائي', 'الجزائري', 'محمد', 'مولسهول', 'المشهور', 'بياسمينة', 'خضرا', 'قوله', 'إن', 'الجزائر', 'كانت', 'تستحق', 'مصيرا', 'أفضل', 'من', 'هذا', 'داعيا', 'إلى', 'إطلاق', 'سراح', 'جميع', 'معتقلي', 'الرأي', 'القابعين', 'في', 'السجون']",30
25,"وتختم الصحيفة بأن الجزائريين باتوا يعيشون في الذكرى الثانية لحراكهم الشعبي ""وهْمُ الجزائرِ الجديدة"" على وقع القمع والمحاكمات المتسارعة للمعارضين والنشطاء، رغم تأكيد السلطات أنه لا يوجد ""معتقلي رأي في الجزائر""، وفق تعبير وزيرِ الاتصال الناطقِ الرسمي باسم الحكومة الجزائرية عمار بلحيمر مطلع هذا الشهر.",JAZ,وتختم الصحيفة بأن الجزائريين باتوا يعيشون في الذكرى الثانية لحراكهم الشعبي وهْمُ الجزائرِ الجديدة على وقع القمع والمحاكمات المتسارعة للمعارضين والنشطاء رغم تأكيد السلطات أنه لا يوجد معتقلي رأي في الجزائر وفق تعبير وزيرِ الاتصال الناطقِ الرسمي باسم الحكومة الجزائرية عمار بلحيمر مطلع هذا الشهر,Modern Standard Arabic,MSA,Modern Standard Arabic,Modern Standard Arabic,Modern Standard Arabic,Modern Standard Arabic,Modern Standard Arabic,1.3582702044675115e-09,1.285061679097542e-07,2.5081805614233166e-10,8.289994036083857e-09,9.556783741171086e-10,2.154730775812209e-08,6.198780681484674e-09,3.3578139617714725e-10,2.9681821982678712e-08,1.083327922090633e-09,9.115689545444675e-09,1.2038704220282306e-08,4.309134877168426e-09,5.359151630656161e-08,5.18524991733941e-09,3.655712415583449e-07,1.5097073796099007e-09,0.9993175431478022,0.0006774621179734084,3.333631072444292e-10,4.279615118235837e-06,1.8028463797596924e-08,4.30164265933564e-08,2.798018324695495e-09,7.668209239481312e-10,6.468211719292125e-10,"['وتختم', 'الصحيفة', 'بأن', 'الجزائريين', 'باتوا', 'يعيشون', 'في', 'الذكرى', 'الثانية', 'لحراكهم', 'الشعبي', 'وهْمُ', 'الجزائرِ', 'الجديدة', 'على', 'وقع', 'القمع', 'والمحاكمات', 'المتسارعة', 'للمعارضين', 'والنشطاء', 'رغم', 'تأكيد', 'السلطات', 'أنه', 'لا', 'يوجد', 'معتقلي', 'رأي', 'في', 'الجزائر', 'وفق', 'تعبير', 'وزيرِ', 'الاتصال', 'الناطقِ', 'الرسمي', 'باسم', 'الحكومة', 'الجزائرية', 'عمار', 'بلحيمر', 'مطلع', 'هذا', 'الشهر']",45
26,وحمل وزير الخارجية رسالة من أمير دولة قطر الشيخ تميم بن حمد آل ثاني، إلى الرئيس ميشال عون، تتضمن الدعم لتشكيل الحكومة ورأب الصدع بين كافة الأطراف السياسية، تمهيدا لفتح الباب أمام المساعدات الاقتصادية لحل الأزمة الراهنة، والمساهمة في إعادة إعمار لبنان.,JAZ,وحمل وزير الخارجية رسالة من أمير دولة قطر الشيخ تميم بن حمد آل ثاني إلى الرئيس ميشال عون تتضمن الدعم لتشكيل الحكومة ورأب الصدع بين كافة الأطراف السياسية تمهيدا لفتح الباب أمام المساعدات الاقتصادية لحل الأزمة الراهنة والمساهمة في إعادة إعمار لبنان,Gulf,MSA,Modern Standard Arabic,Modern Standard Arabic,Modern Standard Arabic,Modern Standard Arabic,Modern Standard Arabic,1.0752402328772274e-05,0.0023639674784464147,3.5032045570444647e-06,6.107412668916441e-05,1.4741873454077044e-06,1.425934691517121e-05,5.952874845417844e-06,3.473226725184664e-06,4.225831407269129e-05,4.140587282658309e-06,2.7891140721194735e-05,0.0004192862957173415,5.3053320757843214e-06,0.00022924326159402274,1.4643361351429787e-05,0.038834746407134704,1.5096430683700273e-07,0.43330985045720494,0.4284929999336154,1.4688698808247562e-07,0.09604775570891587,8.611858960367702e-05,1.885671268031522e-05,6.889118611099121e-07,1.169296683889385e-06,2.90990337490155e-07,"['وحمل', 'وزير', 'الخارجية', 'رسالة', 'من', 'أمير', 'دولة', 'قطر', 'الشيخ', 'تميم', 'بن', 'حمد', 'آل', 'ثاني', 'إلى', 'الرئيس', 'ميشال', 'عون', 'تتضمن', 'الدعم', 'لتشكيل', 'الحكومة', 'ورأب', 'الصدع', 'بين', 'كافة', 'الأطراف', 'السياسية', 'تمهيدا', 'لفتح', 'الباب', 'أمام', 'المساعدات', 'الاقتصادية', 'لحل', 'الأزمة', 'الراهنة', 'والمساهمة', 'في', 'إعادة', 'إعمار', 'لبنان']",42
27,وتأتي هذه الزيارة بعد أيام من زيارة الشيخ محمد بن عبد الرحمن آل ثاني، نائب رئيس مجلس الوزراء القطري وزير الخارجية، إلى لبنان شملت لقاء مع وزير الخارجية اللبناني السابق، جبران باسيل، واتصالا مع رئيس الوزراء المكلف، سعد الحريري، وذلك في إطار مساعٍ قطرية لإيجاد أرضية مشتركة وتوافقية لتشكيل حكومة لبنانية.,JAZ,وتأتي هذه الزيارة بعد أيام من زيارة الشيخ محمد بن عبد الرحمن آل ثاني نائب رئيس مجلس الوزراء القطري وزير الخارجية إلى لبنان شملت لقاء مع وزير الخارجية اللبناني السابق جبران باسيل واتصالا مع رئيس الوزراء المكلف سعد الحريري وذلك في إطار مساعٍ قطرية لإيجاد أرضية مشتركة وتوافقية لتشكيل حكومة لبنانية,Modern Standard Arabic,MSA,Modern Standard Arabic,Modern Standard Arabic,Modern Standard Arabic,Modern Standard Arabic,Modern Standard Arabic,9.730888768683944e-08,7.367836302090701e-07,1.5383522531313252e-08,3.1836114192447506e-07,1.165569854723969e-08,1.9749076932708978e-07,9.555341871750987e-08,2.0573168236401607e-08,4.256232708686173e-07,2.8547265607684626e-08,2.781216249325426e-07,5.672417416943257e-07,4.4267009026224314e-08,1.2783144504378597e-06,1.1468733300516176e-07,4.5251959510837304e-05,5.505687533925158e-09,0.9797845249468328,0.020054076171562567,2.555259419743458e-09,0.00011043494094823771,7.825148593032113e-07,5.391110185505599e-07,1.2359992976651347e-07,1.2384078975512875e-08,1.6397379354516613e-08,"['وتأتي', 'هذه', 'الزيارة', 'بعد', 'أيام', 'من', 'زيارة', 'الشيخ', 'محمد', 'بن', 'عبد', 'الرحمن', 'آل', 'ثاني', 'نائب', 'رئيس', 'مجلس', 'الوزراء', 'القطري', 'وزير', 'الخارجية', 'إلى', 'لبنان', 'شملت', 'لقاء', 'مع', 'وزير', 'الخارجية', 'اللبناني', 'السابق', 'جبران', 'باسيل', 'واتصالا', 'مع', 'رئيس', 'الوزراء', 'المكلف', 'سعد', 'الحريري', 'وذلك', 'في', 'إطار', 'مساعٍ', 'قطرية', 'لإيجاد', 'أرضية', 'مشتركة', 'وتوافقية', 'لتشكيل', 'حكومة', 'لبنانية']",51
28,وأضاف ماكرون، في كلمة عبر الفيديو أمام قمة دول الساحل المنعقدة في النيجر، أنه يجب قطع رؤوس الجماعات المسلحة في الساحل، وأوضح أن التعبئة الدولية من أجل منطقة الساحل لم تكن يوما قوية كما هي اليوم.,JAZ,وأضاف ماكرون في كلمة عبر الفيديو أمام قمة دول الساحل المنعقدة في النيجر أنه يجب قطع رؤوس الجماعات المسلحة في الساحل وأوضح أن التعبئة الدولية من أجل منطقة الساحل لم تكن يوما قوية كما هي اليوم,Modern Standard Arabic,MSA,Modern Standard Arabic,Modern Standard Arabic,Modern Standard Arabic,Modern Standard Arabic,Modern Standard Arabic,6.120351399805359e-09,5.96228308735463e-08,4.117340403777283e-09,3.004877903211648e-08,1.4031482826418653e-08,3.713459561733265e-09,1.2826493499784283e-09,7.306080677182795e-10,3.9758139616030174e-08,1.4107036187845908e-08,1.5240260389115405e-08,1.0394355087724508e-08,8.944622607534104e-09,2.8805548217556506e-08,1.0196042373903823e-08,3.216809731379703e-05,2.30591891343327e-10,0.9999429838860844,2.4210988465615668e-05,5.706482411442262e-10,3.4605477809400914e-07,7.929899379654995e-09,2.98776763189933e-08,1.1940588371724697e-09,3.0237376523439397e-09,1.0332398355122167e-09,"['وأضاف', 'ماكرون', 'في', 'كلمة', 'عبر', 'الفيديو', 'أمام', 'قمة', 'دول', 'الساحل', 'المنعقدة', 'في', 'النيجر', 'أنه', 'يجب', 'قطع', 'رؤوس', 'الجماعات', 'المسلحة', 'في', 'الساحل', 'وأوضح', 'أن', 'التعبئة', 'الدولية', 'من', 'أجل', 'منطقة', 'الساحل', 'لم', 'تكن', 'يوما', 'قوية', 'كما', 'هي', 'اليوم']",36
29,"وأوضح ماكرون أن التعديل الذي سيطرأ على الوجود العسكري الفرنسي في الساحل ""سيعتمد على مشاركة الدول الأخرى في قوة تاكوبا العسكرية التي تقاتل المتشددين في منطقة الساحل إلى جانب الجيشين في مالي ونيجيريا، وقال إن المجر واليونان وصربيا ترغب في الانضمام إلى القوة الدولية التي تشمل عدة دول أوروبية، والتي تحارب الجماعات المسلحة في منطقة الساحل.",JAZ,وأوضح ماكرون أن التعديل الذي سيطرأ على الوجود العسكري الفرنسي في الساحل سيعتمد على مشاركة الدول الأخرى في قوة تاكوبا العسكرية التي تقاتل المتشددين في منطقة الساحل إلى جانب الجيشين في مالي ونيجيريا وقال إن المجر واليونان وصربيا ترغب في الانضمام إلى القوة الدولية التي تشمل عدة دول أوروبية والتي تحارب الجماعات المسلحة في منطقة الساحل,Modern Standard Arabic,MSA,Modern Standard Arabic,Modern Standard Arabic,Modern Standard Arabic,Modern Standard Arabic,Modern Standard Arabic,3.922543509842323e-09,1.068522472038701e-07,3.4710401884181782e-09,2.241553251213182e-08,1.2177894752719689e-08,8.88596338920562e-09,2.5225453352493872e-09,1.2480441771145973e-09,4.4095579395437445e-08,1.703209414993165e-08,1.0823402607312658e-08,2.567094430488698e-08,1.6993377687268637e-08,3.9387939066965855e-08,7.314054804303406e-09,1.6922004305473575e-06,6.906313313869524e-10,0.98831450338291,0.011683105314522482,9.92994073677727e-10,3.263454129866771e-07,1.5275695158161558e-08,2.1376110391966052e-08,3.795443827543217e-09,2.9438180901752984e-09,4.868827729383195e-09,"['وأوضح', 'ماكرون', 'أن', 'التعديل', 'الذي', 'سيطرأ', 'على', 'الوجود', 'العسكري', 'الفرنسي', 'في', 'الساحل', 'سيعتمد', 'على', 'مشاركة', 'الدول', 'الأخرى', 'في', 'قوة', 'تاكوبا', 'العسكرية', 'التي', 'تقاتل', 'المتشددين', 'في', 'منطقة', 'الساحل', 'إلى', 'جانب', 'الجيشين', 'في', 'مالي', 'ونيجيريا', 'وقال', 'إن', 'المجر', 'واليونان', 'وصربيا', 'ترغب', 'في', 'الانضمام', 'إلى', 'القوة', 'الدولية', 'التي', 'تشمل', 'عدة', 'دول', 'أوروبية', 'والتي', 'تحارب', 'الجماعات', 'المسلحة', 'في', 'منطقة', 'الساحل']",56
30,"وكان أسطول بحر البلطيق الروسي أفاد في بيان أمس الاثنين بأن 3 قطع بحرية روسية ستشارك في المناورات، موضحا أن الأخيرة ستشمل ""تحرير سفينة تجارية مختطفة من قبل قراصنة"" وتمارين على إطفاء الحرائق في عرض البحر.",JAZ,وكان أسطول بحر البلطيق الروسي أفاد في بيان أمس الاثنين بأن 3 قطع بحرية روسية ستشارك في المناورات موضحا أن الأخيرة ستشمل تحرير سفينة تجارية مختطفة من قبل قراصنة وتمارين على إطفاء الحرائق في عرض البحر,Modern Standard Arabic,MSA,Modern Standard Arabic,Modern Standard Arabic,Modern Standard Arabic,Modern Standard Arabic,Modern Standard Arabic,2.7567576420578258e-08,3.431291450502971e-07,5.831689369536336e-09,3.919067937152565e-07,1.2852660520659248e-08,2.4547468783660134e-08,1.1665627456226969e-08,5.614346229634128e-09,1.1381430617294184e-05,2.1063255701960476e-08,1.5210484622413076e-07,4.921336782094539e-07,2.3754767745369964e-08,3.906312045117302e-07,4.824782042956114e-07,7.507835456066185e-06,3.5981965751407616e-10,0.9988132733582075,0.0011616780267489702,6.619768632461938e-10,3.577601507681295e-06,1.339921228768181e-07,3.862665127077614e-08,4.406640652161686e-09,1.7337581544183902e-08,1.0814051543589995e-09,"['وكان', 'أسطول', 'بحر', 'البلطيق', 'الروسي', 'أفاد', 'في', 'بيان', 'أمس', 'الاثنين', 'بأن', '3', 'قطع', 'بحرية', 'روسية', 'ستشارك', 'في', 'المناورات', 'موضحا', 'أن', 'الأخيرة', 'ستشمل', 'تحرير', 'سفينة', 'تجارية', 'مختطفة', 'من', 'قبل', 'قراصنة', 'وتمارين', 'على', 'إطفاء', 'الحرائق', 'في', 'عرض', 'البحر']",36
